{
  "version": "3.0.0",
  "generated_at": "2026-05-24",
  "governance_skill": "icon-asset-library-governance v1.0.0-L5",
  "source_policy": {
    "primary_library": "phosphor",
    "supplement_libraries": [
      "remix",
      "lucide"
    ],
    "custom_policy": "custom icons require a Custom Icon Request and ownership review before registry approval",
    "approved_libraries": [
      {
        "library": "phosphor",
        "role": "primary",
        "package": "phosphor-react-native",
        "license": "MIT",
        "license_url": "https://github.com/duongdev/phosphor-react-native/blob/main/LICENSE",
        "attribution_required": false
      },
      {
        "library": "remix",
        "role": "financial-business-supplement",
        "package": "react-native-remix-icon",
        "license": "Remix Icon License v1.0",
        "license_url": "https://github.com/Remix-Design/RemixIcon/blob/master/License",
        "attribution_required": false
      },
      {
        "library": "lucide",
        "role": "system-operation-supplement",
        "package": "lucide-react-native",
        "license": "ISC",
        "license_url": "https://github.com/lucide-icons/lucide/blob/main/LICENSE",
        "attribution_required": false
      },
      {
        "library": "custom",
        "role": "approved-custom-only",
        "package": "internal",
        "license": "custom-owned",
        "license_url": "internal-custom-icon-request",
        "attribution_required": false
      }
    ],
    "blocked_libraries": [
      {
        "library": "hugeicons-free-stroke-rounded",
        "reason": "replaced by latest Icon Asset Library Governance source policy"
      },
      {
        "library": "hugeicons-pro-duotone-rounded",
        "reason": "not approved by latest Icon Asset Library Governance source policy"
      }
    ],
    "forbidden_sources": [
      "unknown SVG",
      "competitor icons",
      "emoji",
      "bitmap functional icons",
      "page-local functional SVG",
      "AI-generated icon without ownership review"
    ],
    "runtime_policy": {
      "delivery": "local-vendored-assets",
      "asset_root": "src/icons/local",
      "renderer": "src/components/AppIcon.tsx",
      "blocked_runtime_dependencies": [
        "phosphor-react-native",
        "react-native-remix-icon",
        "lucide-react-native",
        "@expo/vector-icons",
        "@hugeicons/core-free-icons",
        "@hugeicons/react-native"
      ]
    }
  },
  "taxonomy": [
    "navigation",
    "system",
    "account",
    "trading_account",
    "wallet",
    "banking",
    "trading",
    "copy_trading",
    "ib_partner",
    "kyc_compliance",
    "review",
    "status",
    "notification",
    "security",
    "data",
    "support",
    "promotion",
    "education",
    "brand"
  ],
  "token_contract": {
    "color": [
      "color.icon.primary",
      "color.icon.secondary",
      "color.icon.tertiary",
      "color.icon.inverse",
      "color.icon.disabled",
      "color.icon.success",
      "color.icon.warning",
      "color.icon.danger",
      "color.icon.info",
      "color.icon.active"
    ],
    "size": [
      "size.icon.micro",
      "size.icon.mini",
      "size.icon.xs",
      "size.icon.sm",
      "size.icon.md",
      "size.icon.lg",
      "size.icon.xl",
      "size.icon.xxl",
      "size.icon.display"
    ]
  },
  "migration": {
    "appApple": "icon.brand.apple",
    "actionRefresh": "icon.wallet.withdrawal",
    "transferSwitch": "icon.wallet.transfer",
    "accountBank": "icon.account.trading",
    "notificationBell": "icon.notification.bell",
    "expandDown": "icon.system.chevron_down",
    "navigateBack": "icon.system.back",
    "navigateNext": "icon.system.chevron_right",
    "marketTrend": "icon.trading.market",
    "chatFeedback": "icon.notification.feedback",
    "communityChat": "icon.copy.community",
    "checkMark": "icon.status.check",
    "statusVerified": "icon.status.verified",
    "historyClock": "icon.trading.history",
    "discoverCompass": "icon.navigation.discover",
    "moreDots": "icon.system.more",
    "emailMessage": "icon.notification.email",
    "phoneVerified": "icon.account.phone_verified",
    "rewardGift": "icon.promotion.reward",
    "globalMarket": "icon.market.global",
    "educationCap": "icon.education.academy",
    "supportHeadset": "icon.support.headset",
    "identityCard": "icon.kyc.identity",
    "quoteList": "icon.market.watchlist",
    "taskChecklist": "icon.trading.order",
    "secureLock": "icon.security.lock",
    "passwordRules": "icon.security.password_rules",
    "keyAccess": "icon.security.key_access",
    "keyboardDigits": "icon.system.keyboard_digits",
    "showPassword": "icon.system.password_visible",
    "searchGlass": "icon.system.search",
    "qrCode": "icon.wallet.deposit",
    "partnerNetwork": "icon.ib.network",
    "riskShield": "icon.security.risk_shield",
    "settingsSliders": "icon.system.settings",
    "promoTicket": "icon.promotion.ticket",
    "achievementTrophy": "icon.promotion.achievement",
    "userProfile": "icon.account.user",
    "userAvatar": "icon.account.avatar",
    "addUser": "icon.account.add_user",
    "walletDeposit": "icon.wallet.deposit",
    "walletWithdrawal": "icon.wallet.withdrawal",
    "accountBalance": "icon.wallet.balance",
    "tradingAccount": "icon.account.trading",
    "archiveAccount": "icon.account.archive",
    "destructiveDelete": "icon.system.delete",
    "logoutSession": "icon.system.logout",
    "tradeTicket": "icon.trading.order_ticket",
    "orderList": "icon.trading.order",
    "groupBySymbol": "icon.trading.group_by_symbol",
    "closePosition": "icon.trading.close_position",
    "closeLosingPosition": "icon.trading.close_losing_position",
    "tradeBuy": "icon.trading.buy",
    "tradeSell": "icon.trading.sell",
    "statusRejected": "icon.status.rejected",
    "appRating": "icon.feedback.rating",
    "helpCenter": "icon.support.help_center",
    "aboutApp": "icon.support.about",
    "functionCenter": "icon.navigation.function_center",
    "tradeVolume": "icon.trading.volume",
    "goldCommodity": "icon.market.gold",
    "indexMarket": "icon.market.index",
    "stockAsset": "icon.market.stock",
    "infoCircle": "icon.risk.info",
    "closeX": "icon.system.close"
  },
  "brand_assets": {
    "launcherIcon": "assets/images/icon.png",
    "adaptiveIcon": "assets/images/adaptive-icon.png",
    "splashIcon": "assets/images/splash-icon.png",
    "favicon": "assets/images/favicon.png",
    "contentLogo": "assets/images/dupoin-logo.png",
    "brandSplashLogo": "assets/images/dupoin-logo-white.png"
  },
  "icons": [
    {
      "icon_key": "icon.brand.apple",
      "legacy_names": [
        "appApple"
      ],
      "category": "brand",
      "meaning": "Apple sign-in provider mark",
      "source_library": "phosphor",
      "source_icon_name": "AppleLogo",
      "style": {
        "default": "line",
        "active": "fill",
        "disabled": "line"
      },
      "sizes": [
        8,
        12,
        16,
        20,
        24,
        32,
        40,
        48,
        64
      ],
      "default_size": 17,
      "states": [
        "default"
      ],
      "tone_tokens": [
        "text"
      ],
      "default_tone": "text",
      "token_binding": {
        "color": "color.icon.primary",
        "size": "size.icon.md"
      },
      "usage": [
        "Apple sign-in provider mark.",
        "Apple sign-in provider mark"
      ],
      "forbidden": [
        "Do not recolor as risk or market status."
      ],
      "platforms": [
        "app",
        "h5",
        "web"
      ],
      "license": {
        "name": "MIT",
        "url": "https://github.com/duongdev/phosphor-react-native/blob/main/LICENSE",
        "attribution_required": false
      },
      "modified": false,
      "status": "approved",
      "local_asset_path": "src/icons/local/phosphor/LocalAppleLogoIcon.tsx"
    },
    {
      "icon_key": "icon.wallet.withdrawal",
      "legacy_names": [
        "actionRefresh",
        "walletWithdrawal"
      ],
      "category": "wallet",
      "meaning": "Withdrawal, outgoing funds, payout request, or send-money transaction",
      "source_library": "phosphor",
      "source_icon_name": "HandWithdraw",
      "style": {
        "default": "line",
        "active": "fill",
        "disabled": "line"
      },
      "sizes": [
        8,
        12,
        16,
        20,
        24,
        32,
        40,
        48,
        64
      ],
      "default_size": 24,
      "states": [
        "default",
        "warning",
        "danger"
      ],
      "tone_tokens": [
        "amber",
        "danger",
        "text"
      ],
      "default_tone": "amber",
      "token_binding": {
        "color": "color.icon.warning",
        "size": "size.icon.md"
      },
      "usage": [
        "Refresh or withdraw-style cyclical action when paired with label.",
        "Withdrawal, outgoing funds, payout request, or send-money transaction.",
        "Withdrawal, outgoing funds, payout request, or send-money transaction"
      ],
      "forbidden": [
        "Do not use for price trend.",
        "Do not use for refresh, exchange, or internal transfer."
      ],
      "platforms": [
        "app",
        "h5",
        "web"
      ],
      "license": {
        "name": "MIT",
        "url": "https://github.com/duongdev/phosphor-react-native/blob/main/LICENSE",
        "attribution_required": false
      },
      "modified": false,
      "status": "approved",
      "local_asset_path": "src/icons/local/phosphor/LocalHandWithdrawIcon.tsx"
    },
    {
      "icon_key": "icon.wallet.transfer",
      "legacy_names": [
        "transferSwitch"
      ],
      "category": "wallet",
      "meaning": "Transfer, swap, or two-way movement between accounts",
      "source_library": "phosphor",
      "source_icon_name": "ArrowsLeftRight",
      "style": {
        "default": "line",
        "active": "fill",